Name,Date,Duration,Location,Tags,Note,Moveable,RRULE:FREQ,RRULE:COUNT,Participants
Project kickoff meeting,2023-06-15-10-00,2-00,Conference room,work important,Discuss project goals,true,WEEKLY,6,John Sarah Alex Emma David Lisa
Coffee break,2023-06-18-15-30,0-30,Cafeteria,work break,Relax and socialize,false,DAILY,5,John Sarah Emma David Lisa
Business conference,2023-06-20-09-00,8-00,Convention center,conference networking,Attend industry presentations,false,N/A,N/A,All attendees
Client presentation,2023-06-23-14-00,1-30,Client's office,business meeting,Present project proposal,true,DAILY,3,John Sarah Alex
Dinner with friends,2023-06-25-18-30,3-00,Restaurant,friends food,Enjoy good food and conversation,true,N/A,N/A,David Lisa Michael Emma Sarah
Training workshop,2023-06-27-09-00,4-00,Training center,workshop learning,Learn new skills and techniques,false,WEEKLY,4,John Sarah Alex Emma
Product demo,2023-07-01-11-00,1-00,Office,business meeting,Showcase new product features,false,DAILY,5,John Sarah Alex Emma David
Company anniversary celebration,2023-07-30-17-00,6-00,Company premises,celebration fun,Celebrate company's anniversary with employees,false,N/A,N/A,All employees
Networking event,2023-08-02-18-30,3-00,Hotel ballroom,networking social,Network with professionals from various industries,false,N/A,N/A,Attendees
